{
  "schema_version": 4,
  "as_of": "2026-10-08",
  "roster": {
    "path": "VIDEO_INVENTORY_2026-10-07.md",
    "unique_total": 791,
    "long_form": 703,
    "shorts": 88
  },
  "quality_targets": {
    "direct_evidence_coverage": 1,
    "time_sensitive_primary_verification": 1,
    "video_id_match": 1,
    "human_review_for_decision_ready": true
  },
  "pilots": [
    {
      "video_id": "OlurWhrOsLs",
      "title": "[상품지식] 1만원으로 투자 시작하는 5가지 방법 (for.완전초보)",
      "published_at": "2019-09-13",
      "category": "투자입문",
      "pilot_scenario": "짧은 입문 영상·원칙과 실행 조언 구분",
      "verification_targets": [
        "투자 원칙의 적용 전제 및 위험"
      ],
      "stage": "INVENTORIED",
      "legacy_read": "REVIEW_REQUIRED",
      "source_acquisition": "PENDING",
      "visual_review": "NOT_REVIEWED"
    },
    {
      "video_id": "okrUVN8l3zk",
      "title": "[상품지식] ETF 하나면 충분합니다 (1편)",
      "published_at": "2019-12-15",
      "category": "ETF",
      "pilot_scenario": "구형 상품설명·현행 ETF 제도 차이",
      "verification_targets": [
        "ETF 분산 및 추적오차·비용"
      ],
      "stage": "INVENTORIED",
      "legacy_read": "REVIEW_REQUIRED",
      "source_acquisition": "PENDING",
      "visual_review": "NOT_REVIEWED"
    },
    {
      "video_id": "oxMpNgnbISw",
      "title": "📈 마켓타이밍 필요없는 마음 편히 할 수 있는 투자 | 자산배분 사용설명서 | 박곰희 포트폴리오 |  ver2026",
      "published_at": "2026-08-28",
      "category": "자산배분",
      "pilot_scenario": "2026 실제 자산배분 비중이 화면에 나타날 수 있음",
      "verification_targets": [
        "자산군 정의 및 목표비중·리밸런싱"
      ],
      "stage": "INVENTORIED",
      "legacy_read": "REVIEW_REQUIRED",
      "source_acquisition": "PENDING",
      "visual_review": "NOT_REVIEWED"
    },
    {
      "video_id": "a-890uldXeo",
      "title": "👨🏻‍🦳👵🏻 연금저축 사용설명서 | 연말정산 세액공제 가능한 연금저축펀드 | ver.2026",
      "published_at": "2026-07-24",
      "category": "연금저축",
      "pilot_scenario": "현행 세제한도·상품 운용 가능범위",
      "verification_targets": [
        "세액공제·계좌 한도 최신 법령"
      ],
      "stage": "INVENTORIED",
      "legacy_read": "REVIEW_REQUIRED",
      "source_acquisition": "PENDING",
      "visual_review": "NOT_REVIEWED"
    },
    {
      "video_id": "DVEdeOoCtXA",
      "title": "👴👵 연금저축과 IRP의 결정적인 차이 | 어떤 게 더 좋아요? | 2026년 리뉴얼",
      "published_at": "2026-07-29",
      "category": "IRP",
      "pilot_scenario": "IRP와 연금저축 비교표/위험자산 한도",
      "verification_targets": [
        "중도인출·위험자산 비율 등 규제"
      ],
      "stage": "INVENTORIED",
      "legacy_read": "REVIEW_REQUIRED",
      "source_acquisition": "PENDING",
      "visual_review": "NOT_REVIEWED"
    },
    {
      "video_id": "PW1EuMtw18o",
      "title": "[Product Knowledge] If I make a lot of profit with an ISA, will I get hit with a health insurance...",
      "published_at": "2021-08-11",
      "category": "ISA",
      "pilot_scenario": "2021년 건보료 설명과 2026년 해석 충돌",
      "verification_targets": [
        "법령 적용연도·건보료 소득 산정"
      ],
      "stage": "INVENTORIED",
      "legacy_read": "REVIEW_REQUIRED",
      "source_acquisition": "PENDING",
      "visual_review": "NOT_REVIEWED"
    },
    {
      "video_id": "WJPZ2GuyM2w",
      "title": "[상품지식] 채권을 알면 절반을 이해한거에요!! (1편)",
      "published_at": "2020-01-14",
      "category": "채권",
      "pilot_scenario": "구형 채권 가격/금리 원리 설명",
      "verification_targets": [
        "듀레이션·채권 구조·금리 위험"
      ],
      "stage": "INVENTORIED",
      "legacy_read": "REVIEW_REQUIRED",
      "source_acquisition": "PENDING",
      "visual_review": "NOT_REVIEWED"
    },
    {
      "video_id": "LoRySWrV0Us",
      "title": "🧑🏻‍🏫 커버드콜이 뭐길래 배당을 저렇게 많이 줄 수 있는 걸까?ㅣ커버드콜",
      "published_at": "2025-04-02",
      "category": "배당",
      "pilot_scenario": "커버드콜 현금흐름과 총수익 차이",
      "verification_targets": [
        "분배금 출처·옵션 전략·하락위험"
      ],
      "stage": "INVENTORIED",
      "legacy_read": "REVIEW_REQUIRED",
      "source_acquisition": "PENDING",
      "visual_review": "NOT_REVIEWED"
    },
    {
      "video_id": "Gk3-ZC9W3vw",
      "title": "👀 ISA에서 미국배당주 사면 손해인가요? | 그럼에도 ISA를 해야 하는 이유 | 외국납부세액공제",
      "published_at": "2026-04-08",
      "category": "세금",
      "pilot_scenario": "외국납부세액·시점 의존성이 높은 제도",
      "verification_targets": [
        "ISA 해외주식형 ETF 세제와 공제"
      ],
      "stage": "INVENTORIED",
      "legacy_read": "REVIEW_REQUIRED",
      "source_acquisition": "PENDING",
      "visual_review": "NOT_REVIEWED"
    },
    {
      "video_id": "i32DeJPzsfE",
      "title": "😆 평범한 직장인이 7억을 모을 수 있었던 이유는?ㅣ구독자사연ㅣ당신의 투자를 보여주세요ㅣ당투보",
      "published_at": "2026-08-21",
      "category": "사례",
      "pilot_scenario": "성공 사례·자산 축적액의 선택편향",
      "verification_targets": [
        "시뮬레이션 가정 및 재현성"
      ],
      "stage": "INVENTORIED",
      "legacy_read": "REVIEW_REQUIRED",
      "source_acquisition": "PENDING",
      "visual_review": "NOT_REVIEWED"
    }
  ]
}
